{
  "$schema": "https://json-schema.org/draft/2020-12/schema",
  "$id": "sloneek-video/recipe",
  "title": "Recipe",
  "description": "Deterministic, LLM-free replay script for one onboarding video. Produced by explorer, consumed by recorder + assembler.",
  "type": "object",
  "required": [
    "id",
    "version",
    "lang",
    "viewport",
    "start",
    "steps"
  ],
  "properties": {
    "id": {
      "type": "string",
      "description": "slug, e.g. attendance-overview"
    },
    "version": {
      "type": "integer"
    },
    "title": {
      "type": "string"
    },
    "lang": {
      "type": "string",
      "enum": [
        "cs",
        "en",
        "sk",
        "pl"
      ]
    },
    "app_version": {
      "type": "string",
      "description": "Sloneek FE version/date this recipe was verified against"
    },
    "viewport": {
      "type": "object",
      "properties": {
        "width": {
          "type": "integer"
        },
        "height": {
          "type": "integer"
        }
      },
      "required": [
        "width",
        "height"
      ]
    },
    "start": {
      "type": "object",
      "description": "How to get to the first screen. Auth is handled by recorder via env (SLONEEK_DEMO_URL/USER/PASS) or storageState file.",
      "required": [
        "url"
      ],
      "properties": {
        "url": {
          "type": "string"
        },
        "storage_state": {
          "type": "string",
          "description": "path to Playwright storageState json (logged-in session)"
        },
        "local_storage": {
          "type": "object",
          "additionalProperties": {
            "type": "string"
          },
          "description": "localStorage keys set before cleanup and recording (page is reloaded when something changed). Sloneek UI language: {\"local-translate\": \"cs\"|\"pl\"|\"en\"}. The recorder uses the real browser profile, so state the UI language in every recipe."
        },
        "timezone": {
          "type": "string",
          "description": "IANA timezone (e.g. \"Europe/Lisbon\") the recorder emulates via CDP Emulation.setTimezoneOverride on the recording page and every tab it opens, before cleanup and recording. Use the timezone the app expects (Sloneek: company.country.timezone from auth/me) so time-zone hints such as 'Jiné časové pásmo' do not appear."
        }
      }
    },
    "voice": {
      "type": "object",
      "properties": {
        "provider": {
          "type": "string",
          "enum": [
            "elevenlabs",
            "external",
            "espeak",
            "mock"
          ],
          "description": "external = mp3 files already placed in out/<id>/audio/<stepId>.mp3 (e.g. generated by Claude via the ElevenLabs connector); assembler only measures them"
        },
        "voice_id": {
          "type": "string"
        },
        "model_id": {
          "type": "string"
        },
        "language_code": {
          "type": "string",
          "description": "BCP-47 language enforced on the TTS model (default recipe.lang). Sent to the API only for models that accept it (flash/turbo v2.5, v3); the /onboarding-video skill sets it on the connector's TTS node."
        },
        "speed": {
          "type": "number",
          "minimum": 0.7,
          "maximum": 1.2,
          "description": "Speaking tempo, 1 = the voice's natural pace (default from config/voices.json `speed`, else 1). API provider: sent as voice_settings.speed. External provider (connector clips): fetch-voice.mjs applies ffmpeg atempo on download, pitch unchanged. Must be set BEFORE recording - the recorder paces steps by clip length."
        }
      }
    },
    "steps": {
      "type": "array",
      "minItems": 1,
      "items": {
        "$ref": "#/$defs/step"
      }
    },
    "chapters": {
      "type": "boolean",
      "default": true,
      "description": "Write out/<id>/chapters.txt (YouTube chapter list, times in final.mp4) from the steps' `part` / `part_title`. Only written when at least one step has a part."
    },
    "interstitials": {
      "type": "boolean",
      "default": true,
      "description": "Insert a 1.5 s card \"<part> / <part_title>\" (brand colours) before every step whose part differs from the previous step's (never before the very first step – the intro covers it). mux --no-interstitials overrides."
    },
    "thumbnail": {
      "description": "YouTube thumbnail (out/<id>/thumbnail.png, brand card style). false = none.",
      "oneOf": [
        {
          "type": "boolean",
          "const": false
        },
        {
          "type": "object",
          "additionalProperties": false,
          "properties": {
            "shot": {
              "type": "string",
              "description": "step id whose screenshot (shots/<id>.png) is shown; default first step of the 2nd part. Pick a screen without an open modal."
            },
            "title": {
              "type": "string",
              "description": "shorter title for the thumbnail (default recipe.title); 2-4 words read best"
            }
          }
        }
      ]
    },
    "pronunciation": {
      "description": "Per-video pronunciation rules on top of config/pronunciation.json (spoken text only, subtitles unchanged). Array of rules, or { <lang>: [rules] }.",
      "oneOf": [
        {
          "type": "array",
          "items": {
            "type": "object",
            "required": [
              "match",
              "say"
            ],
            "properties": {
              "match": {
                "type": "string"
              },
              "say": {
                "type": "string"
              },
              "stem": {
                "type": "boolean"
              },
              "case": {
                "enum": [
                  "sensitive",
                  "insensitive"
                ]
              },
              "note": {
                "type": "string"
              }
            }
          }
        },
        {
          "type": "object",
          "additionalProperties": {
            "type": "array",
            "items": {
              "type": "object",
              "required": [
                "match",
                "say"
              ],
              "properties": {
                "match": {
                  "type": "string"
                },
                "say": {
                  "type": "string"
                },
                "stem": {
                  "type": "boolean"
                },
                "case": {
                  "enum": [
                    "sensitive",
                    "insensitive"
                  ]
                },
                "note": {
                  "type": "string"
                }
              }
            }
          }
        }
      ]
    },
    "cleanup": {
      "type": "array",
      "description": "Pre-run cleanup executed once before recording (screencast mode: not in the video). Removes leftovers of a previous run so retries start from a clean tenant. Each block optionally opens `url` and runs only if `if_visible` is visible within 3 s. Errors are logged and ignored.",
      "items": {
        "type": "object",
        "required": [
          "actions"
        ],
        "properties": {
          "name": {
            "type": "string"
          },
          "url": {
            "type": "string"
          },
          "if_visible": {
            "type": "string",
            "description": "selector (same syntax as actions) that must be visible for the block to run"
          },
          "actions": {
            "type": "array",
            "items": {
              "$ref": "#/$defs/action"
            }
          }
        }
      }
    },
    "teardown": {
      "type": "array",
      "description": "Post-run teardown (screencast mode): same format as cleanup, executed after the screencast stopped (not in the video). Use for demo objects that must not stay visible to other users between runs.",
      "items": {
        "type": "object",
        "required": [
          "actions"
        ],
        "properties": {
          "name": {
            "type": "string"
          },
          "url": {
            "type": "string"
          },
          "if_visible": {
            "type": "string",
            "description": "selector (same syntax as actions) that must be visible for the block to run"
          },
          "actions": {
            "type": "array",
            "items": {
              "$ref": "#/$defs/action"
            }
          }
        }
      }
    }
  },
  "$defs": {
    "step": {
      "type": "object",
      "required": [
        "id",
        "narration",
        "actions"
      ],
      "properties": {
        "id": {
          "type": "string",
          "pattern": "^s[0-9]{2,3}$"
        },
        "narration": {
          "type": "string",
          "description": "One idea per step. Spoken while actions run. Empty string = silent step. Default for both `subtitle` and `narration_tts`."
        },
        "subtitle": {
          "type": "string",
          "description": "Text for final.srt (what the viewer reads). Default = narration. Timing still comes from the audio alignment of narration_tts (mapped proportionally when the texts differ). Empty string = no subtitle for this step."
        },
        "narration_tts": {
          "type": "string",
          "description": "Text sent to TTS / the external voiceover (numbers and acronyms spelled out for the AI voice, e.g. \"kej pí áj\" for KPI). Default = narration. Also the text used for the audio cache and stale-clip detection."
        },
        "part": {
          "type": "integer",
          "minimum": 1,
          "description": "Video part (brief: 1 Úvod, 2 Nastavení, 3 Ukázka využití, 4 Pohled manažera/zaměstnance, 5 Závěr). Set it on the first step of a part; later steps without `part` inherit it. A change of part => interstitial card + chapter."
        },
        "part_title": {
          "type": "string",
          "description": "Title of the part (card text \"<part> / <part_title>\", chapter title). Needed only on the first step of the part."
        },
        "actions": {
          "type": "array",
          "items": {
            "$ref": "#/$defs/action"
          }
        },
        "hold_after_ms": {
          "type": "integer",
          "default": 800,
          "description": "Extra pause after audio AND actions both finished"
        },
        "min_duration_ms": {
          "type": "integer",
          "description": "Optional floor for the step even if audio is shorter"
        },
        "expect": {
          "type": "object",
          "description": "Post-condition checked by recorder; failure => step marked failed for self-heal.",
          "properties": {
            "visible": {
              "type": "string",
              "description": "selector that must be visible"
            },
            "url_contains": {
              "type": "string"
            }
          }
        },
        "voice_after_actions": {
          "oneOf": [
            {
              "type": "boolean"
            },
            {
              "type": "integer",
              "minimum": 1
            }
          ],
          "description": "Delay the narration so it never talks over a loading page. true = start after all actions of the step; N = start right after action N (1-based, typically a wait_ready), the remaining actions run under the voice. Default/false = narration starts with the step."
        }
      }
    },
    "action": {
      "type": "object",
      "required": [
        "type"
      ],
      "properties": {
        "type": {
          "type": "string",
          "enum": [
            "navigate",
            "click",
            "hover",
            "type",
            "fill",
            "press",
            "select",
            "scroll",
            "wait",
            "highlight",
            "zoom",
            "upload",
            "wait_ready"
          ],
          "description": "zoom = smooth page zoom on `selector` (400 ms in, hold_ms, 400 ms out; origin = element centre, moved only as far as needed to keep the zoomed element on screen; scale clamped to fit; cursor glides onto the element if it is not on it). fill = cursor clicks the field, then the whole `value` is set at once (+ input/change events) – for long texts. wait_ready = wait until `selector` (optional) is visible, the network is idle and no loading spinner is shown; value = max ms (default 20000)."
        },
        "selector": {
          "type": "string",
          "description": "Playwright locator string. Prefer data-testid / role+text."
        },
        "value": {
          "type": "string",
          "description": "navigate: url; type/fill: text; press: key; select: option; wait: ms; scroll: 'down'|'up'|selector; zoom: scale, e.g. \"1.6\" (default 1.6); upload: local file path for an <input type=file>"
        },
        "clear": {
          "type": "boolean",
          "description": "type: clear field first (fill always replaces the value)"
        },
        "delay_ms": {
          "type": "integer",
          "description": "type: per-char delay in ms (default 35; speed \"fast\" = 15; recordVideo+beacon recorder mode keeps 80 / 40). Wins over `speed`."
        },
        "before_ms": {
          "type": "integer",
          "description": "pause before this action (default 300)"
        },
        "speed": {
          "type": "string",
          "enum": [
            "normal",
            "fast"
          ],
          "description": "type: \"fast\" = 15 ms per char instead of 35. For long texts prefer `fill` (instant)."
        },
        "hold_ms": {
          "type": "integer",
          "minimum": 0,
          "description": "zoom: how long to stay zoomed in (default 2500). Total action time = 400 ms in + hold_ms + 400 ms out."
        }
      }
    }
  }
}
